{
  "$schema": "https://json-schema.org/draft/2020-12/schema",
  "$id": "https://example.invalid/sast/progress.schema.json",
  "title": "SAST 진행상태",
  "description": "결과 집계와 아직 결과가 없는 임시 상태·비고. 브라우저 백업의 draftResults는 필요할 때 포함하는 상세 결과 초안이며 정본 결과가 아니다.",
  "type": "object",
  "required": ["schemaVersion", "workspaceId", "updatedAt", "items"],
  "properties": {
    "schemaVersion": { "const": "1.0" },
    "workspaceId": { "type": "string" },
    "updatedAt": { "type": ["string", "null"], "format": "date-time" },
    "activityEvents": {
      "type": "array",
      "description": "같은 작업공간의 누적 브라우저 변경 이력. 이전 검사 차수도 보존하며 파일 작업 이력 정본 반영은 별도 절차다. 옛 백업에는 이 필드가 없을 수 있다.",
      "items": {
        "type": "object",
        "required": ["schemaVersion", "eventId", "recordedAt", "workspaceId", "reportId", "operationId", "attemptId", "kind", "action", "outcome", "source", "actor", "itemIds", "summary", "before", "after", "evidence", "important"],
        "description": "상세 계약은 activity-event.schema.json 및 공통 기록기의 검증을 따른다. 출처·작업공간·중복 ID도 별도로 대조한다."
      }
    },
    "items": {
      "type": "object",
      "additionalProperties": {
        "type": "object",
        "required": ["workflowStatus", "conclusion", "note"],
        "properties": {
          "workflowStatus": {
            "description": "진행 단계: todo=미착수, in-progress=작업 중, analyzed=분석 완료, change-complete=수정 완료, verified=검증 완료, deferred=보류. 검증 이후 현재 소스·근거가 달라졌는지는 별도로 확인합니다.",
            "enum": ["todo", "in-progress", "analyzed", "change-complete", "verified", "deferred"]
          },
          "conclusion": {
            "description": "판단: unreviewed=미검토, fix=수정, false-positive=오탐, operations=운영 설정, exception=예외, needs-review=추가 검토.",
            "enum": ["unreviewed", "fix", "false-positive", "operations", "exception", "needs-review"]
          },
          "note": { "type": "string" },
          "updatedAt": { "type": ["string", "null"], "format": "date-time" }
        },
        "additionalProperties": true
      }
    }
  },
  "additionalProperties": true
}
