{
  "schemaVersion": "1.0",
  "workspaceId": "sample-workspace",
  "updatedAt": "2026-01-01T01:00:00Z",
  "items": {
    "SAMPLE-001": {
      "workflowStatus": "verified",
      "conclusion": "fix",
      "note": "필수 입력 검증과 대상 테스트를 완료했습니다. (합성 예시)",
      "updatedAt": "2026-01-01T01:00:00Z"
    }
  }
}
